[
  {
    "date": "2026-02-16",
    "description": "Card Payment to Putney Cricket Clu On 14 Feb",
    "debit": 4.0,
    "credit": 0.0,
    "balance": 20.36,
    "category": "Entertainment",
    "bank": "Barclays Bank"
  },
  {
    "date": "2026-02-23",
    "description": "Direct Debit to O2 Ref: D9880367",
    "debit": 19.2,
    "credit": 0.0,
    "balance": null,
    "category": "Utilities",
    "bank": "Barclays Bank"
  },
  {
    "date": "2026-02-23",
    "description": "Card Payment to Putney Cricket Clu On 22 Feb",
    "debit": 4.0,
    "credit": 0.0,
    "balance": null,
    "category": "Entertainment",
    "bank": "Barclays Bank"
  },
  {
    "date": "2026-02-23",
    "description": "Received From Piyush Mishra & PA Ref: Piyush Barclays",
    "debit": 0.0,
    "credit": 100.0,
    "balance": 97.16,
    "category": "Income",
    "bank": "Barclays Bank"
  },
  {
    "date": "2026-02-25",
    "description": "Card Payment to Google Youtubeprem On 24 Feb",
    "debit": 19.99,
    "credit": 0.0,
    "balance": 77.17,
    "category": "Entertainment",
    "bank": "Barclays Bank"
  },
  {
    "date": "2026-02-27",
    "description": "Direct Debit to Virgin Media Pymts Ref: 685538205001",
    "debit": 30.1,
    "credit": 0.0,
    "balance": 47.07,
    "category": "Utilities",
    "bank": "Barclays Bank"
  }
]